smartctl 7.5 2025-04-30 r5714 [Darwin 25.6.0 arm64] (local build)
Copyright (C) 2002-25, Bruce Allen, Christian Franke, www.smartmontools.org

=== START OF INFORMATION SECTION ===
Model Number:                       Sabrent Rocket 4TB
Serial Number:                      007370a13a42602e
Firmware Version:                   2973.120
PCI Vendor/Subsystem ID:            0x106b
IEEE OUI Identifier:                0x000000
Controller ID:                      0
NVMe Version:                       <1.2
Number of Namespaces:               3
Local Time is:                      Thu Jul 30 11:32:27 2026 EDT
Firmware Updates (0x02):            1 Slot
Optional Admin Commands (0x0004):   Frmw_DL
Optional NVM Commands (0x0004):     DS_Mngmt
Maximum Data Transfer Size:         256 Pages

Supported Power States
St Op     Max   Active     Idle   RL RT WL WT  Ent_Lat  Ex_Lat
 0 +     0.00W       -        -    0  0  0  0        0       0

=== START OF SMART DATA SECTION ===
SMART overall-health self-assessment test result: PASSED

SMART/Health Information (NVMe Log 0x02, NSID 0xffffffff)
Critical Warning:                   0x00
Temperature:                        29 Celsius
Available Spare:                    100%
Available Spare Threshold:          99%
Percentage Used:                    1%
Data Units Read:                    29,627,104 [15.1 TB]
Data Units Written:                 25,535,302 [13.0 TB]
Host Read Commands:                 1,281,708,676
Host Write Commands:                713,925,377
Controller Busy Time:               0
Power Cycles:                       164
Power On Hours:                     243
Unsafe Shutdowns:                   9
Media and Data Integrity Errors:    0
Error Information Log Entries:      0

Read 1 entries from Error Information Log failed: GetLogPage failed: system=0x38, sub=0x0, code=745

